{
  "schemaVersion": "1.0",
  "adapterId": "qwen-cli",
  "host": {
    "name": "Qwen CLI",
    "minimumVersion": "0.20.0"
  },
  "agentDefinition": "agent-definition/algorithm-debug-agent-v1.json",
  "templates": {
    "mcpServer": "templates/mcp-server.json",
    "extension": "templates/extension.json",
    "agent": "templates/algorithm-debug-agent.md"
  },
  "outputFiles": {
    "extension": "qwen-extension.json",
    "agent": "agents/algorithm-debug-agent.md"
  },
  "mcpServerName": "algorithm-debug"
}
